{
  "schema_version": "risk_contract.v2",
  "contract_version": "v2",
  "policy": {
    "version": "risk-policy-v2-fixture",
    "owner": "side",
    "effective_from": "2026-05-15",
    "required_fields": [
      "candidate.surface.runtime_surface",
      "candidate.sizing.requested_size",
      "decision.fail_close_reason",
      "application.runtime_sizing_applied"
    ],
    "fail_close_rules": [
      {
        "condition": "missing required policy field",
        "decision_class": "block",
        "fail_close_reason": "missing_required_policy_field"
      }
    ],
    "rules": {
      "non_stop_fail_close_reason": "not_fail_closed"
    }
  },
  "candidate": {
    "candidate_schema_version": "risk_contract.v2.candidate.v1",
    "candidate_id": "v2-base-valid",
    "strategy_id": "fixture_strategy",
    "symbol_or_universe": "EURUSD",
    "timeframe": "1h",
    "validation_refs": [
      "reports/v8.3/scan_wfd_runtime_cap_application_evidence.md"
    ],
    "surface": {
      "runtime_surface": "backtest",
      "surface_status": "guarded",
      "analysis_scope": "none",
      "analysis_scope_status": "not_applicable"
    },
    "sizing": {
      "requested_size": 1.0,
      "requested_size_basis": "unit_backtest_run"
    },
    "surface_payload": {
      "fixture_kind": "schema_only",
      "runtime_adoption": "not_approved"
    },
    "artifact_root": "reports/tmp/risk_contract_v2_fixture/base_valid"
  },
  "evidence": {
    "refs": [
      "docs/plans/2026-05-15-risk-contract-v2-schema-file-tdd.md"
    ],
    "validator_proof_refs": [
      "tests/test_risk_contract_v2_schema.py"
    ]
  },
  "context": {
    "fixture_scope": "schema_only",
    "validator_acceptance": "approved",
    "runtime_adoption": "not_approved"
  },
  "decision": {
    "decision_class": "size",
    "allowed_size": 1.0,
    "binding_rule": "allow_full_size_fixture",
    "supporting_rules": [],
    "fail_close_reason": "not_fail_closed",
    "evidence_refs": [
      "docs/plans/2026-05-15-risk-contract-v2-schema-file-tdd.md"
    ],
    "policy_version": "risk-policy-v2-fixture"
  },
  "application": {
    "execution_state": "continued",
    "application_status": "not_applicable",
    "runtime_sizing_applied": false,
    "sizing_effect": "none",
    "effective_size": 1.0,
    "metrics_rescaled": false,
    "application_reason": "validator-accepted fixture only; no runtime acceptance"
  },
  "trace": {
    "policy_version": "risk-policy-v2-fixture",
    "candidate_id": "v2-base-valid",
    "input_evidence_refs": [
      "docs/plans/2026-05-15-risk-contract-v2-schema-file-tdd.md"
    ],
    "binding_rule": "allow_full_size_fixture",
    "decision_class": "size",
    "emitted_artifact_path": "risk/contracts/v2/fixtures/valid/base_valid.json",
    "validated_schema_version": "risk_contract.v2",
    "validator_result_schema_version": "risk_contract_validator_result.v2"
  }
}
