{
  "schema_version": "risk_contract.v2",
  "contract_version": "v2",
  "policy": {
    "version": "risk-policy-v2-fixture",
    "owner": "side",
    "effective_from": "2026-05-15",
    "required_fields": [
      "candidate.surface.runtime_surface",
      "candidate.sizing.requested_size",
      "decision.fail_close_reason",
      "application.runtime_sizing_applied"
    ],
    "fail_close_rules": [
      {
        "condition": "live runtime not implemented",
        "decision_class": "block",
        "fail_close_reason": "candidate_validation_failure"
      }
    ],
    "rules": {
      "live_runtime_claim_allowed": false,
      "live_claim_block_reason": "live_runtime_not_implemented"
    }
  },
  "candidate": {
    "candidate_schema_version": "risk_contract.v2.candidate.v1",
    "candidate_id": "v2-live-not-claimable-valid",
    "strategy_id": "fixture_strategy",
    "symbol_or_universe": "EURUSD",
    "timeframe": "1h",
    "validation_refs": [
      "reports/v8.2/paper_live_runtime_sizing_guards_evidence.md"
    ],
    "surface": {
      "runtime_surface": "live",
      "surface_status": "not_wired",
      "analysis_scope": "none",
      "analysis_scope_status": "not_applicable"
    },
    "sizing": {
      "requested_size": 1.0,
      "requested_size_basis": "unit_backtest_run"
    },
    "surface_payload": {
      "fixture_kind": "schema_only_live_not_claimable",
      "live_runtime": "not_wired_not_claimable",
      "live_runtime_claim_allowed": false
    },
    "artifact_root": "reports/tmp/risk_contract_v2_fixture/live_not_claimable_valid"
  },
  "evidence": {
    "refs": [
      "reports/v8.2/paper_live_runtime_sizing_guards_evidence.md",
      "docs/plans/2026-05-15-risk-contract-v2-schema-draft-design.md"
    ],
    "validator_proof_refs": [
      "tests/test_risk_contract_v2_fixture_matrix.py"
    ]
  },
  "context": {
    "fixture_scope": "schema_only",
    "validator_acceptance": "approved",
    "runtime_adoption": "not_approved",
    "live_runtime_claim_allowed": false,
    "claim_block_reason": "live_runtime_not_implemented"
  },
  "decision": {
    "decision_class": "block",
    "allowed_size": 0.0,
    "binding_rule": "live_runtime_not_implemented",
    "supporting_rules": [
      "surface_status_not_wired"
    ],
    "fail_close_reason": "candidate_validation_failure",
    "evidence_refs": [
      "reports/v8.2/paper_live_runtime_sizing_guards_evidence.md"
    ],
    "policy_version": "risk-policy-v2-fixture"
  },
  "application": {
    "execution_state": "stopped",
    "application_status": "not_claimable",
    "runtime_sizing_applied": false,
    "sizing_effect": "not_applicable",
    "effective_size": 0.0,
    "metrics_rescaled": false,
    "application_reason": "live runtime is not wired; no live runtime claim is allowed"
  },
  "trace": {
    "policy_version": "risk-policy-v2-fixture",
    "candidate_id": "v2-live-not-claimable-valid",
    "input_evidence_refs": [
      "reports/v8.2/paper_live_runtime_sizing_guards_evidence.md"
    ],
    "binding_rule": "live_runtime_not_implemented",
    "decision_class": "block",
    "emitted_artifact_path": "risk/contracts/v2/fixtures/valid/live_not_claimable_valid.json",
    "validated_schema_version": "risk_contract.v2",
    "validator_result_schema_version": "risk_contract_validator_result.v2"
  }
}
